{
  "$schema": "../../schemas/audio-provider-manifest-v2.schema.json",
  "schema_version": 2,
  "id": "dev.wyrmgrid.fake-audio",
  "name": "WyrmGrid deterministic fake audio provider",
  "version": "0.4.0",
  "audio_protocol_version": 2,
  "author": "WyrmGrid contributors",
  "entry_point": "wyrmgrid-fake-audio-provider",
  "platforms": [
    "windows_x86_64",
    "linux_x86_64",
    "macos_aarch64",
    "macos_x86_64"
  ],
  "capabilities": [
    "source_enumeration",
    "permission_requests",
    "pcm_s16le_capture",
    "level_metering",
    "hot_plug_notifications",
    "clock_synchronization"
  ]
}
